{"generated_at":"2026-10-16T23:53:30Z","schema_version":1,"sources":[{"source":"kev","ok":true,"error":"","items":1786,"last_success_at":"2026-10-16T23:53:30Z"},{"source":"nvd","ok":true,"error":"","items":11739,"last_success_at":"2026-10-16T23:53:30Z"},{"source":"ransomwarelive","ok":true,"error":"","items":100,"last_success_at":"2026-10-16T23:53:30Z"},{"source":"rss","ok":true,"error":"","items":105,"last_success_at":"2026-10-16T23:53:30Z"},{"source":"feodotracker","ok":true,"error":"","items":5,"last_success_at":"2026-10-16T23:53:30Z"},{"source":"threatfox","ok":true,"error":"","items":0,"last_success_at":"2026-10-16T23:53:30Z"},{"source":"picket","ok":false,"error":"Client error '404 Not Found' for url 'https://raw.githubusercontent.com/SaltyCarl/socdesk-picket-export/main/export.json'\nFor more information check: https://developer.mozilla.org/en-US/docs/Web/HTTP/Status/404","items":0,"last_success_at":""},{"source":"epss","ok":true,"error":"","items":34950,"last_success_at":"2026-10-16T23:53:30Z"}],"pipeline_warnings":["cves.json: invalid, kept last-known-good (payload 19905121 bytes exceeds 16000000 cap)","DRIFT: CVE-2008-2992 is KEV-flagged ransomware-associated but does not appear in any seed group's initial_access_cves","DRIFT: CVE-2009-3960 is KEV-flagged ransomware-associated but does not appear in any seed group's initial_access_cves","DRIFT: CVE-2010-0188 is KEV-flagged ransomware-associated but does not appear in any seed group's initial_access_cves","DRIFT: CVE-2010-0738 is KEV-flagged ransomware-associated but does not appear in any seed group's initial_access_cves","DRIFT: CVE-2010-1428 is KEV-flagged ransomware-associated but does not appear in any seed group's initial_access_cves","DRIFT: CVE-2010-2861 is KEV-flagged ransomware-associated but does not appear in any seed group's initial_access_cves","DRIFT: CVE-2012-0158 is KEV-flagged ransomware-associated but does not appear in any seed group's initial_access_cves","DRIFT: CVE-2012-0507 is KEV-flagged ransomware-associated but does not appear in any seed group's initial_access_cves","DRIFT: CVE-2012-1710 is KEV-flagged ransomware-associated but does not appear in any seed group's initial_access_cves","DRIFT: CVE-2012-1723 is KEV-flagged ransomware-associated but does not appear in any seed group's initial_access_cves","DRIFT: CVE-2012-4681 is KEV-flagged ransomware-associated but does not appear in any seed group's initial_access_cves","DRIFT: CVE-2013-0074 is KEV-flagged ransomware-associated but does not appear in any seed group's initial_access_cves","DRIFT: CVE-2013-0422 is KEV-flagged ransomware-associated but does not appear in any seed group's initial_access_cves","DRIFT: CVE-2013-0431 is KEV-flagged ransomware-associated but does not appear in any seed group's initial_access_cves","DRIFT: CVE-2013-2465 is KEV-flagged ransomware-associated but does not appear in any seed group's initial_access_cves","DRIFT: CVE-2013-2551 is KEV-flagged ransomware-associated but does not appear in any seed group's initial_access_cves","DRIFT: CVE-2013-3993 is KEV-flagged ransomware-associated but does not appear in any seed group's initial_access_cves","DRIFT: CVE-2014-1812 is KEV-flagged ransomware-associated but does not appear in any seed group's initial_access_cves","DRIFT: CVE-2015-1701 is KEV-flagged ransomware-associated but does not appear in any seed group's initial_access_cves","DRIFT: CVE-2015-2291 is KEV-flagged ransomware-associated but does not appear in any seed group's initial_access_cves","DRIFT: CVE-2015-2546 is KEV-flagged ransomware-associated but does not appear in any seed group's initial_access_cves","DRIFT: CVE-2015-7645 is KEV-flagged ransomware-associated but does not appear in any seed group's initial_access_cves","DRIFT: CVE-2016-0034 is KEV-flagged ransomware-associated but does not appear in any seed group's initial_access_cves","DRIFT: CVE-2016-0099 is KEV-flagged ransomware-associated but does not appear in any seed group's initial_access_cves","DRIFT: CVE-2016-0151 is KEV-flagged ransomware-associated but does not appear in any seed group's initial_access_cves","DRIFT: CVE-2016-0167 is KEV-flagged ransomware-associated but does not appear in any seed group's initial_access_cves","DRIFT: CVE-2016-0189 is KEV-flagged ransomware-associated but does not appear in any seed group's initial_access_cves","DRIFT: CVE-2016-1019 is KEV-flagged ransomware-associated but does not appear in any seed group's initial_access_cves","DRIFT: CVE-2016-3309 is KEV-flagged ransomware-associated but does not appear in any seed group's initial_access_cves","DRIFT: CVE-2016-3351 is KEV-flagged ransomware-associated but does not appear in any seed group's initial_access_cves","DRIFT: CVE-2016-4117 is KEV-flagged ransomware-associated but does not appear in any seed group's initial_access_cves","DRIFT: CVE-2016-7255 is KEV-flagged ransomware-associated but does not appear in any seed group's initial_access_cves","DRIFT: CVE-2017-0101 is KEV-flagged ransomware-associated but does not appear in any seed group's initial_access_cves","DRIFT: CVE-2017-0143 is KEV-flagged ransomware-associated but does not appear in any seed group's initial_access_cves","DRIFT: CVE-2017-0144 is KEV-flagged ransomware-associated but does not appear in any seed group's initial_access_cves","DRIFT: CVE-2017-0145 is KEV-flagged ransomware-associated but does not appear in any seed group's initial_access_cves","DRIFT: CVE-2017-0146 is KEV-flagged ransomware-associated but does not appear in any seed group's initial_access_cves","DRIFT: CVE-2017-0147 is KEV-flagged ransomware-associated but does not appear in any seed group's initial_access_cves","DRIFT: CVE-2017-0148 is KEV-flagged ransomware-associated but does not appear in any seed group's initial_access_cves","DRIFT: CVE-2017-0199 is KEV-flagged ransomware-associated but does not appear in any seed group's initial_access_cves","DRIFT: CVE-2017-0213 is KEV-flagged ransomware-associated but does not appear in any seed group's initial_access_cves","DRIFT: CVE-2017-1000253 is KEV-flagged ransomware-associated but does not appear in any seed group's initial_access_cves","DRIFT: CVE-2017-10271 is KEV-flagged ransomware-associated but does not appear in any seed group's initial_access_cves","DRIFT: CVE-2017-11357 is KEV-flagged ransomware-associated but does not appear in any seed group's initial_access_cves","DRIFT: CVE-2017-11882 is KEV-flagged ransomware-associated but does not appear in any seed group's initial_access_cves","DRIFT: CVE-2017-12149 is KEV-flagged ransomware-associated but does not appear in any seed group's initial_access_cves","DRIFT: CVE-2017-12615 is KEV-flagged ransomware-associated but does not appear in any seed group's initial_access_cves","DRIFT: CVE-2017-18362 is KEV-flagged ransomware-associated but does not appear in any seed group's initial_access_cves","DRIFT: CVE-2017-5638 is KEV-flagged ransomware-associated but does not appear in any seed group's initial_access_cves","DRIFT: CVE-2017-6884 is KEV-flagged ransomware-associated but does not appear in any seed group's initial_access_cves","DRIFT: CVE-2017-7494 is KEV-flagged ransomware-associated but does not appear in any seed group's initial_access_cves","DRIFT: CVE-2017-9822 is KEV-flagged ransomware-associated but does not appear in any seed group's initial_access_cves","DRIFT: CVE-2018-0802 is KEV-flagged ransomware-associated but does not appear in any seed group's initial_access_cves","DRIFT: CVE-2018-10562 is KEV-flagged ransomware-associated but does not appear in any seed group's initial_access_cves","DRIFT: CVE-2018-11138 is KEV-flagged ransomware-associated but does not appear in any seed group's initial_access_cves","DRIFT: CVE-2018-1273 is KEV-flagged ransomware-associated but does not appear in any seed group's initial_access_cves","DRIFT: CVE-2018-13374 is KEV-flagged ransomware-associated but does not appear in any seed group's initial_access_cves","DRIFT: CVE-2018-13382 is KEV-flagged ransomware-associated but does not appear in any seed group's initial_access_cves","DRIFT: CVE-2018-13383 is KEV-flagged ransomware-associated but does not appear in any seed group's initial_access_cves","DRIFT: CVE-2018-15982 is KEV-flagged ransomware-associated but does not appear in any seed group's initial_access_cves","DRIFT: CVE-2018-19320 is KEV-flagged ransomware-associated but does not appear in any seed group's initial_access_cves","DRIFT: CVE-2018-19321 is KEV-flagged ransomware-associated but does not appear in any seed group's initial_access_cves","DRIFT: CVE-2018-19322 is KEV-flagged ransomware-associated but does not appear in any seed group's initial_access_cves","DRIFT: CVE-2018-19323 is KEV-flagged ransomware-associated but does not appear in any seed group's initial_access_cves","DRIFT: CVE-2018-19943 is KEV-flagged ransomware-associated but does not appear in any seed group's initial_access_cves","DRIFT: CVE-2018-19949 is KEV-flagged ransomware-associated but does not appear in any seed group's initial_access_cves","DRIFT: CVE-2018-19953 is KEV-flagged ransomware-associated but does not appear in any seed group's initial_access_cves","DRIFT: CVE-2018-20250 is KEV-flagged ransomware-associated but does not appear in any seed group's initial_access_cves","DRIFT: CVE-2018-20753 is KEV-flagged ransomware-associated but does not appear in any seed group's initial_access_cves","DRIFT: CVE-2018-2380 is KEV-flagged ransomware-associated but does not appear in any seed group's initial_access_cves","DRIFT: CVE-2018-4878 is KEV-flagged ransomware-associated but does not appear in any seed group's initial_access_cves","DRIFT: CVE-2018-6530 is KEV-flagged ransomware-associated but does not appear in any seed group's initial_access_cves","DRIFT: CVE-2018-6789 is KEV-flagged ransomware-associated but does not appear in any seed group's initial_access_cves","DRIFT: CVE-2018-6882 is KEV-flagged ransomware-associated but does not appear in any s